created_at;id_str;full_text;quote_count;reply_count;retweet_count;favorite_count;lang;user_id_str;conversation_id_str;username;tweet_url
Sun Aug 06 04:54:48 +0000 2023;1688050970524299264;"Menyaksikan pergelaran angklung oleh 15 ribuan orang di Stadion Utama Gelora Bung Karno Jakarta, semalam.   Pesertanya, dari anggota Organisasi Aksi Solidaritas Era Kabinet Indonesia Maju, PNS, TNI-Polri sampai pelajar, hendak mencatatkan rekor dunia pergelaran angklung terbesar. https://t.co/SKOzvsraAv";16;140;511;3328;in;366987179;1688050970524299264;jokowi;https://twitter.com/jokowi/status/1688050970524299264
Fri Aug 04 05:34:12 +0000 2023;1687336108919799808;"Jalan Tol Ciawi-Sukabumi ruas Cigombong-Cibadak juga mempercepat mobilitas orang dan barang sehingga meningkatkan jumlah investasi di Jawa Barat. Berdasarkan hasil survei, infrastuktur jalan tol di Jawa Barat menjadi alasan utama bagi para investor berinvestasi di provinsi ini. https://t.co/8v7m0ztWdF";2;24;80;522;in;366987179;1687336094613069824;jokowi;https://twitter.com/jokowi/status/1687336108919799808
Fri Aug 04 05:34:10 +0000 2023;1687336101068124161;"Dengan adanya ruas tol baru ini, perjalanan dari Jakarta ke Sukabumi hanya memakan waktu sekitar 2,5 jam saja. Jalan tol ini juga mempermudah akses menuju sejumlah tempat wisata di sekitar Sukabumi, di antaranya Pelabuhan Ratu, Geopark Ciletuh, Ujung Genteng, hingga Gunung Gede. https://t.co/jhtyXZV78Y";8;29;104;651;in;366987179;1687336094613069824;jokowi;https://twitter.com/jokowi/status/1687336101068124161
Fri Aug 04 05:34:08 +0000 2023;1687336094613069824;"Dulu, perjalanan dengan mobil dari Jakarta ke Sukabumi, Jawa Barat, makan waktu 5-6 jam. Lalu, jalan tol Bocimi dibangun.   Ruas tol Bocimi Seksi I Ciawi-Cigombong telah beroperasi. Dan hari ini, saya meresmikan beroperasinya ruas tol Cigombong-Cibadak yang panjangnya 11,9 km. https://t.co/pZ07sGGOJa";60;339;586;3889;in;366987179;1687336094613069824;jokowi;https://twitter.com/jokowi/status/1687336094613069824
Thu Aug 03 08:27:37 +0000 2023;1687017365085769728;"LRT Jabodebek nantinya akan terintegrasi dengan moda transportasi lainnya seperti MRT, TransJakarta, kereta bandara, hingga KRL. Stasiun Dukuh Atas di Jakarta Pusat akan menjadi titik sentral pertemuan moda-moda transportasi tersebut. https://t.co/0gUbNNrBYu";7;55;160;1175;in;366987179;1687015346405007360;jokowi;https://twitter.com/jokowi/status/1687017365085769728
Thu Aug 03 08:19:36 +0000 2023;1687015346405007360;"Pengoperasian LRT Jabodebek akan menjadikan keamanan dan keselamatan sebagai faktor utama. Karena itu, kita tidak akan tergesa-gesa mengoperasikannya.   LRT ini merupakan yang pertama di Indonesia. Wajar jika masih ada kekurangan yang perlu dievaluasi dan diperbaiki. https://t.co/3JCrXuQljl";163;454;506;3377;in;366987179;1687015346405007360;jokowi;https://twitter.com/jokowi/status/1687015346405007360
Thu Aug 03 07:53:53 +0000 2023;1687008875864846336;"Hari ini saya kembali menjajal kereta LRT Jabodebek dari Stasiun Harjamukti, Depok, Jawa Barat hingga Stasiun Dukuh Atas, Jakarta Pusat. Kereta berangkat pukul 08.18 WIB dan, seperti saat beroperasi normal nanti, berhenti di sejumlah stasiun yang dilalui.   Alhamdulillah,… https://t.co/FntFaME4R8";62;272;917;5405;in;366987179;1687008875864846336;jokowi;https://twitter.com/jokowi/status/1687008875864846336
Wed Aug 02 08:18:26 +0000 2023;1686652665114374144;"Kepada seluruh pelaku batik Indonesia, saya berharap dapat memanfaatkan sebaik-baiknya momentum kebangkitan ekonomi Indonesia dengan terus mengembangkan batik yang kita miliki, mengeksplorasi desain, motif, dan warna agar batik semakin beragam dan menarik. https://t.co/lkvmAtiLjm";0;6;75;428;in;366987179;1686652618008068096;jokowi;https://twitter.com/jokowi/status/1686652665114374144
Wed Aug 02 08:18:18 +0000 2023;1686652633107578885;"Batik sangat istimewa, indah, dan sarat makna dan filosofi.  Batik juga telah menciptakan banyak lapangan kerja hingga memberikan penghasilan serta kehidupan bagi jutaan rakyat Indonesia. Nilai dan perputaran dari industri batik di Tanah Air juga terus meningkat. https://t.co/WqzJbNqxqL";1;13;78;456;in;366987179;1686652618008068096;jokowi;https://twitter.com/jokowi/status/1686652633107578885
Wed Aug 02 08:18:15 +0000 2023;1686652618008068096;"Membuka Gelaran Batik Nusantara hari ini dengan apresiasi kepada para pelaku batik di seluruh Tanah Air. Mereka adalah para pengrajin, desainer, pengusaha, juga pecinta dan pemakai batik yang berkreasi menciptakan, memproduksi, dan menggunakan batik sebagai karya adiluhur bangsa. https://t.co/d0vpqDr7bY";6;110;450;2838;in;366987179;1686652618008068096;jokowi;https://twitter.com/jokowi/status/1686652618008068096
Wed Aug 02 02:10:06 +0000 2023;1686559971025313793;"Salah satu yang patut kita syukuri di tahun ini adalah situasi ekonomi pascapandemi Covid-19 yang dapat terkendali dan kembali pulih berkat kerja keras dan gotong royong seluruh rakyat. Maka, semalam di halaman Istana Merdeka, kita menggelar acara Zikir dan Doa Kebangsaan,… https://t.co/bbTkQgNbbG";45;403;807;6005;in;366987179;1686559971025313793;jokowi;https://twitter.com/jokowi/status/1686559971025313793
Tue Aug 01 04:04:08 +0000 2023;1686226282202443776;"Karena itulah, program hilirisasi ini jangan berhenti pada industri mineral saja, tetapi juga pada sektor lainnya. Untuk itu, saat menghadiri pengurus Asosiasi Pengusaha Indonesia (Apindo) 2023-2028 semalam, saya mengajak para pengusaha untuk turut mendukung program hilirisasi. https://t.co/xvS7hkhidH";0;32;76;438;in;366987179;1686226155928764422;jokowi;https://twitter.com/jokowi/status/1686226282202443776
Tue Aug 01 04:03:51 +0000 2023;1686226210601463808;"Hilirisasi juga memberikan dampak positif pada pertumbuhan ekonomi daerah yang kemudian berpengaruh terhadap pertumbuhan ekonomi secara nasional.   Pertumbuhan ekonomi Maluku Utara yang sebelumnya rata-rata 5,7%, setelah hilirisasi jadi 23%.  Dan berbagai dampak positif lainnya. https://t.co/NWo9dNxDiC";3;29;86;503;in;366987179;1686226155928764422;jokowi;https://twitter.com/jokowi/status/1686226210601463808
Tue Aug 01 04:03:44 +0000 2023;1686226181589504001;"Hilirisasi juga memberikan kontribusi besar pada pendapatan negara.   Dulu, tahun 2014 sampai 2015, pemerintah menghasilkan kurang lebih Rp31 triliun dari ekspor bahan mentah. Setelah hilirisasi, menjadi Rp510 triliun. https://t.co/YXqMmiknhx";4;20;69;291;in;366987179;1686226155928764422;jokowi;https://twitter.com/jokowi/status/1686226181589504001
Tue Aug 01 04:03:38 +0000 2023;1686226155928764422;"Hilirisasi telah menciptakan sejumlah dampak positif bagi perekonomian Indonesia.   Di Sulawesi Tengah, sebelum hilirisasi nikel, pengolahan nikel mempekerjakan hanya 1.800 tenaga kerja. Setelah hilirisasi, industri ini menyerap 71.500 tenaga kerja! https://t.co/oaa1wtDgGp";46;388;642;3429;in;366987179;1686226155928764422;jokowi;https://twitter.com/jokowi/status/1686226155928764422
Mon Jul 31 10:51:25 +0000 2023;1685966389516111872;"Selesai sudah pembangunan Sodetan Ciliwung di Jakarta, setelah dikerjakan selama hampir 11 tahun. Hari ini, salah satu infrastruktur pendukung untuk penanganan banjir di DKI Jakarta itu saya resmikan dari lokasi inlet di Jl. Otista. https://t.co/Be0amkXoiV";42;230;696;4457;in;366987179;1685966389516111872;jokowi;https://twitter.com/jokowi/status/1685966389516111872
Mon Jul 31 08:30:34 +0000 2023;1685930943490797568;"Saya memantau masalah kelaparan di wilayah Papua Tengah beberapa waktu terakhir. Masalah ini dipicu oleh beberapa hal, utamanya cuaca ekstrem di distrik di daerah tinggi. Dalam cuaca ekstrem, tanaman tidak bisa tumbuh sehingga masyarakat kesulitan mendapatkan bahan makanan.… https://t.co/Q1zY13GanT";58;659;703;5448;in;366987179;1685930943490797568;jokowi;https://twitter.com/jokowi/status/1685930943490797568
Mon Jul 31 06:08:59 +0000 2023;1685895311057952768;"Sodetan Ciliwung dibangun untuk mengalirkan sebagian debit banjir dari Sungai Ciliwung menuju Kanal Banjir Timur (KBT). Tidak hanya sebagai pengendali banjir, kawasan tersebut juga dilengkapi sejumlah fasilitas umum seperti taman bermain, tempat kebugaran luar ruangan, toilet… https://t.co/UmaagJslpY";31;209;539;3481;in;366987179;1685895311057952768;jokowi;https://twitter.com/jokowi/status/1685895311057952768
Mon Jul 31 06:04:06 +0000 2023;1685894084807028736;"Penanganan banjir di Jakarta memang harus dilakukan komprehensif dari hulu sampai ke hilir. Masih ada 12 sungai lain di Jakarta yang perlu ditangani. Ada Sungai Sunter, Sungai Cipinang, Sungai Mookervart, Sungai Pesanggrahan, dll, serta ancaman  banjir rob ke daratan Jakarta. https://t.co/JWCmbXYulY";0;9;58;400;in;366987179;1685894063416041472;jokowi;https://twitter.com/jokowi/status/1685894084807028736
Mon Jul 31 06:04:05 +0000 2023;1685894078347829248;"Sodetan Ciliwung baru dapat menyelesaikan masalah banjir di enam kelurahan atau sekitar 62% dari masalah banjir di Jakarta. Sisanya, masih harus diselesaikan oleh Kementerian PUPR dan Pemprov DKI Jakarta secara bersama. https://t.co/FsWfiyO4vI";1;7;64;429;in;366987179;1685894063416041472;jokowi;https://twitter.com/jokowi/status/1685894078347829248
Mon Jul 31 06:04:03 +0000 2023;1685894070324039680;"Sodetan Ciliwung telah dikerjakan hampir 11 tahun dengan anggaran hingga Rp1,150 triliun. Sodetan Ciliwung berupa dua terowongan sepanjang 1,2 km untuk mengalirkan air dari Kali Ciliwung di titik inlet di Jalan Otista menuju Kanal Banjir Timur saat siaga banjir. https://t.co/sr4GdVRDBy";0;3;52;271;in;366987179;1685894063416041472;jokowi;https://twitter.com/jokowi/status/1685894070324039680
Mon Jul 31 06:04:01 +0000 2023;1685894063416041472;"Pemerintah telah menyelesaikan pembangunan sejumlah infrastruktur yang dapat mendukung penanganan banjir di DKI Jakarta.   Dua bendungan kering di hulu di Kab. Bogor, yakni Waduk Ciawi dan Waduk Sukamahi, sudah selesai. Dan hari ini, saya meresmikan Sodetan Ciliwung di Jakarta. https://t.co/yhmlFEnBAz";16;185;527;2988;in;366987179;1685894063416041472;jokowi;https://twitter.com/jokowi/status/1685894063416041472
Sat Jul 29 11:16:40 +0000 2023;1685247966146330624;"Dua bulan lalu, saya memesan kemeja putih kepada para siswa SMK Negeri 4 Kota Jambi yang saya dapati sedang melaksanakan praktikum di jurusan tata busana. Kemeja inilah yang saya pakai, kali ini dalam kunjungan ke Bengkulu. Pas banget di badan saya, enak dipakai, kualitas… https://t.co/pwZCbljgOS";31;221;727;5058;in;366987179;1685247966146330624;jokowi;https://twitter.com/jokowi/status/1685247966146330624
Sat Jul 29 02:33:54 +0000 2023;1685116409490386944;"Pembukaan FISU World University Games berlangsung meriah di Dong’an Lake Sports Park Stadium, Chengdu, semalam. Saya dan Ibu Negara hadir dan menyaksikan defile atlet dari 119 negara di lapangan, dari tribun bersama pemimpin negara lainnya.   Di pentas olahraga mahasiswa sedunia… https://t.co/HlrBaAIkmd";9;98;404;3002;in;366987179;1685116409490386944;jokowi;https://twitter.com/jokowi/status/1685116409490386944
Fri Jul 28 13:19:11 +0000 2023;1684916412866007040;"Menyaksikan penandatanganan sejumlah dokumen kerja sama dalam membangun ekosistem hilirisasi industri kaca dan panel surya di Indonesia di Hotel Shangri-La, Chengdu, hari ini.  Perjanjian kerja sama itu dilakukan bersama Xinyi Glass, perusahaan bidang kaca terbesar di dunia.… https://t.co/7sSvsA9aAJ";12;157;334;2521;in;366987179;1684916412866007040;jokowi;https://twitter.com/jokowi/status/1684916412866007040
Fri Jul 28 09:24:28 +0000 2023;1684857343555883008;"Jumat siang di Chengdu, RRT. Kami menunaikan ibadah salat Jumat di Hotel Shangri-La.  Bertindak sebagai khatib sekaligus imam adalah Bapak Muhadjir Effendy, Menteri Koordinator Bidang Pembangunan Manusia dan Kebudayaan. https://t.co/XNSBM6nOMe";26;160;487;4781;in;366987179;1684857343555883008;jokowi;https://twitter.com/jokowi/status/1684857343555883008
Fri Jul 28 09:22:21 +0000 2023;1684856809813929984;"Bersama Presiden Xi Jinping dan Madam Peng Liyuan menjelang jamuan santap siang bersama di Hotel Jinniu, Chengdu, hari ini.  Santap siang dalam rangka FISU World University Games 2023 ini dihadiri sejumlah pemimpin negara lainnya. https://t.co/b9dX1c7JwN";8;125;328;2862;in;366987179;1684856809813929984;jokowi;https://twitter.com/jokowi/status/1684856809813929984
Fri Jul 28 09:19:57 +0000 2023;1684856206404599808;"Pertemuan bisnis bersama Kamar Dagang Indonesia di Tiongkok (INACHAM) dan sejumlah pengusaha Tiongkok hari ini di Chengdu.  Indonesia berkomitmen menjaga investasi tetap stabil dan berjalan baik. Maka, saya minta para investor tidak ragu menyampaikan kendala yang mereka hadapi. https://t.co/bm7Scd8wCi";23;205;331;2380;in;366987179;1684856206404599808;jokowi;https://twitter.com/jokowi/status/1684856206404599808
Thu Jul 27 14:24:34 +0000 2023;1684570479183695873;"Saat saya dan Presiden Xi Jinping menggelar pertemuan bilateral di Hotel Jinniu, Chengdu, di ruang lain Ibu Negara menerima jamuan minum teh oleh Madam Peng Liyuan.  Madam Peng menunjukkan koleksi guci dan kain, meracik teh hijau, juga mengajak Ibu Negara melukis di mangkuk teh. https://t.co/a95Y1ZLbDg";15;147;520;3913;in;366987179;1684570479183695873;jokowi;https://twitter.com/jokowi/status/1684570479183695873
Thu Jul 27 13:43:54 +0000 2023;1684560245107064832;"Kami juga membahas beberapa isu kawasan meliputi kerja sama ASEAN-RRT hingga dukungan RRT terhadap sentralitas ASEAN untuk mewujudkan kawasan Indo-Pasifik yang damai dan sejahtera.  Usai pertemuan, kami menyaksikan penandatanganan sejumlah dokumen kerja sama oleh kedua negara. https://t.co/MTzPyCU6vn";2;16;113;978;in;366987179;1684559368401059843;jokowi;https://twitter.com/jokowi/status/1684560245107064832
Thu Jul 27 13:42:22 +0000 2023;1684559859285635074;"Dalam pertemuan tersebut, kami membahas sejumlah kerja sama antara kedua negara yang meliputi antara lain penguatan perdagangan, investasi, kerja sama kesehatan, kerja sama pembangunan Ibu Kota Nusantara, hingga kerja sama riset serta teknologi. https://t.co/IVK78xDCk8";3;17;101;884;in;366987179;1684559368401059843;jokowi;https://twitter.com/jokowi/status/1684559859285635074
Thu Jul 27 13:40:25 +0000 2023;1684559368401059843;"Dari Bandara Internasional Tianfu, saya dan Ibu Negara menuju Hotel Jinniu, Chengdu, sore ini. Di sana, Presiden Xi Jinping dan Madam Peng telah datang dan menyambut kami. Terima kasih, Yang Mulia.  Saya dan Presiden Xi Jinping kemudian menggelar pertemuan bilateral di hotel ini. https://t.co/n9OeTaC37D";25;116;534;4049;in;366987179;1684559368401059843;jokowi;https://twitter.com/jokowi/status/1684559368401059843
Thu Jul 27 11:22:13 +0000 2023;1684524588095668226;"Hujan gerimis menyambut ketibaan kami di Bandar Udara Internasional Tianfu, Kota Chengdu, Tiongkok setelah menempuh lima jam penerbangan dari Jakarta. Waktu setempat menunjukkan pukul  14.40. https://t.co/yb0PsVWaTE";15;241;493;3539;in;366987179;1684524588095668226;jokowi;https://twitter.com/jokowi/status/1684524588095668226
Thu Jul 27 05:16:53 +0000 2023;1684432648465453056;"Dengan e-katalog ini, apabila masih ada yang melompati sistem dan mengambil sesuatu dari situ, ya dia akan berhadapan dengan hukum tanpa pandang bulu. Kalau sampai ada yang tertangkap tangan, terkena OTT oleh KPK, hormati proses hukum yang berjalan.";3;36;72;385;in;366987179;1684432645265195009;jokowi;https://twitter.com/jokowi/status/1684432648465453056
Thu Jul 27 05:16:52 +0000 2023;1684432645265195009;"Pemerintah terus melakukan evaluasi dan perbaikan sistem untuk mencegah praktik korupsi, antara lain dengan pengadaan barang dan jasa di kementerian/lembaga melalui e-katalog. Sekarang yang tercantum dalam e-katalog sudah lebih dari 4 juta produk, dari sebelumnya hanya 50 ribu. https://t.co/rMrEVTAbLV";42;492;497;3091;in;366987179;1684432645265195009;jokowi;https://twitter.com/jokowi/status/1684432645265195009
Thu Jul 27 03:25:15 +0000 2023;1684404553989640193;"Di Chengdu, RRT, saya akan bertemu dengan Presiden Xi Jinping, lalu bertemu para pemimpin perusahaan Tiongkok, kemudian menghadiri pembukaan FISU World University Games untuk menyemangati kontingen kita di sana.  Mohon doa dari seluruh rakyat untuk kelancaran perjalanan ini.";0;28;63;437;in;366987179;1684404550671933441;jokowi;https://twitter.com/jokowi/status/1684404553989640193
Thu Jul 27 03:25:14 +0000 2023;1684404550671933441;"Saya meninggalkan Tanah Air pagi ini menuju Tiongkok untuk antara lain memenuhi undangan Presiden Xi Jinping.   Kunjungan ini juga bertepatan dengan 10 tahun kemitraan strategis komprehensif Indonesia dan Tiongkok, negara mitra dagang dan investasi terbesar bagi Indonesia. https://t.co/yEMFLByN1O";62;566;563;4359;in;366987179;1684404550671933441;jokowi;https://twitter.com/jokowi/status/1684404550671933441
Wed Jul 26 11:52:12 +0000 2023;1684169746797977600;"Saya percaya, para perwira remaja TNI dan Polri memiliki semangat tinggi dan kemampuan untuk mewujudkan kemajuan Indonesia. https://t.co/o9xL5HsedZ";4;29;90;1228;in;366987179;1684169171603701762;jokowi;https://twitter.com/jokowi/status/1684169746797977600
Wed Jul 26 11:49:55 +0000 2023;1684169171603701762;"Melantik dan mengambil sumpah 833 calon perwira remaja TNI dan Kepolisian di halaman Istana Negara, hari ini.   Mereka terdiri atas lulusan Akademi Militer sebanyak 357 orang, Akademi Angkatan Laut 94 orang, Akademi Angkatan Udara 114 orang, dan Akademi Kepolisian 268 orang. https://t.co/2RRktMgVMm";10;132;353;3228;in;366987179;1684169171603701762;jokowi;https://twitter.com/jokowi/status/1684169171603701762
Wed Jul 26 11:32:23 +0000 2023;1684164759070056450;"Kepada para perwira remaja TNI-Polri yang hari ini dilantik saya berpesan agar selalu mengikuti perkembangan teknologi. Siapkan diri terhadap ancaman yang juga menggunakan teknologi. https://t.co/qauq6bCLa3";1;6;52;425;in;366987179;1684164727726026752;jokowi;https://twitter.com/jokowi/status/1684164759070056450
Wed Jul 26 11:32:16 +0000 2023;1684164727726026752;"TNI-Polri memiliki tugas yang tidak mudah, diantaranya menjaga stabilitas keamanan negara, menjaga tegaknya NKRI, serta meneruskan tongkat estafet kepemimpinan bangsa dan negara. Apalagi saat ini dunia berubah cepat, disrupsi teknologi, dan geopolitik yang sangat dinamis. https://t.co/Oi2TfV9AdJ";3;58;279;1782;in;366987179;1684164727726026752;jokowi;https://twitter.com/jokowi/status/1684164727726026752
Tue Jul 25 01:18:14 +0000 2023;1683647817108312064;"Permintaan pembangunan tol tersebut tidak hanya di Pulau Jawa saja, melainkan dari setiap daerah. Namun, pemerintah memprioritaskan pembangunan jalan tol di luar Jawa. Sementara untuk di Pulau Jawa sendiri, masih dipersilakan dengan catatan, perhitungan investasinya layak.";3;43;65;518;in;366987179;1683647813656387585;jokowi;https://twitter.com/jokowi/status/1683647817108312064
Tue Jul 25 01:18:14 +0000 2023;1683647813656387585;"Permintaan pembangunan jalan tol banyak kita terima karena manfaatnya banyak dirasakan masyarakat. Para kepala daerah, gubernur, bupati, wali kota, melihat bahwa tol bisa memicu titik-titik pertumbuhan ekonomi baru, mempercepat mobilitas orang, barang, dan mobilitas logistik. https://t.co/LP5iB07AC0";96;777;683;5336;in;366987179;1683647813656387585;jokowi;https://twitter.com/jokowi/status/1683647813656387585
Mon Jul 24 14:36:25 +0000 2023;1683486296704942080;"Saya menginstruksikan seluruh jajaran pemerintah, baik di tingkat pusat maupun daerah, untuk memperbanyak kegiatan pasar murah. Bagi yang memiliki anggaran, saya perintahkan untuk meningkatkan jumlah pemberian bantuan sembako bagi masyarakat yang membutuhkan. https://t.co/yuNMMetDoq";4;22;61;593;in;366987179;1683486282628968450;jokowi;https://twitter.com/jokowi/status/1683486296704942080
Mon Jul 24 14:36:22 +0000 2023;1683486282628968450;"El Nino merupakan fenomena iklim yang tidak bisa diprediksi sehingga dibutuhkan langkah-langkah pencegahan terhadap dampak yang akan ditimbulkannya. Beberapa negara seperti India dan Vietnam telah mengalaminya, sehingga tidak lagi melakukan ekspor beras. https://t.co/Gtm6LAcVdw";7;99;271;2073;in;366987179;1683486282628968450;jokowi;https://twitter.com/jokowi/status/1683486282628968450
Mon Jul 24 12:28:17 +0000 2023;1683454050971561984;"Karena itu, perlu mencari mitra kerja dan menjalin kerja sama dengan pihak lain agar pengembangan PT Pindad dapat berjalan dengan lebih cepat. Pemerintah juga akan memindahkan pabrik PT Pindad di Bandung ke kawasan industri di Subang secara bertahap untuk pengembangan perusahaan. https://t.co/YdO3wcnUGJ";0;14;103;672;in;366987179;1683454035620429824;jokowi;https://twitter.com/jokowi/status/1683454050971561984
Mon Jul 24 12:28:15 +0000 2023;1683454042905927680;"Saat ini dunia kekurangan peluru. Setiap kunjungan saya ke negara lain, ketersediaan peluru selalu menjadi topik antarpemimpin negara.   Ini peluang bagi industri pertahanan kita. Bukan hanya peluru saja, tapi juga senjata, kendaraan, karena permintaannya banyak. https://t.co/zcOWHcOLCE";3;27;100;722;in;366987179;1683454035620429824;jokowi;https://twitter.com/jokowi/status/1683454042905927680
Mon Jul 24 12:28:13 +0000 2023;1683454035620429824;"Industri pertahanan Indonesia memiliki peluang yang baik di masa mendatang.   PT Pindad (Persero) misalnya, dulu memproduksi 275 juta peluru. Pemerintah kemudian memberi suntikan modal Rp700 miliar melalui skema PMN. Produksi peluru PT Pindad pun meningkat jadi 415 juta. https://t.co/4CzpCq19v3";16;130;430;2766;in;366987179;1683454035620429824;jokowi;https://twitter.com/jokowi/status/1683454035620429824
Mon Jul 24 03:05:57 +0000 2023;1683312537100771329;"Kita harus mempersiapkan dan menjaga Pemilu tahun depan agar hasilnya baik. Prosesnya juga baik.  Sebagai pesta demokrasi, sudah seharusnya rakyat bergembira dengan adanya pemilu. Rakyat juga harus terbebas dari ketakutan-ketakutan dan tidak boleh ada pertengkaran-pertengkaran. https://t.co/njPpT5W4h8";108;1099;699;4848;in;366987179;1683312537100771329;jokowi;https://twitter.com/jokowi/status/1683312537100771329
Sun Jul 23 09:45:38 +0000 2023;1683050733049098241;"Meninjau rekonstruksi Jalan Raya Surakarta-Gemolong-Purwodadi di Kab. Sragen, Jawa Tengah. Jalan ini sering rusak karena kondisi tanahnya labil.  Karena itulah, rekonstruksi jalan ini dibuat lebih kokoh, dicor lebih tebal. Biayanya lebih mahal tapi pemakaiannya akan lebih lama. https://t.co/2Smg1On9M3";25;166;386;2869;in;366987179;1683050733049098241;jokowi;https://twitter.com/jokowi/status/1683050733049098241
Sun Jul 23 01:25:18 +0000 2023;1682924817799061505;"Generasi terbaik bangsa selalu lahir dari zaman yang memberi tempat yang lapang bagi setiap anak untuk bertumbuh bebas, cerdas, dan ceria.   Perlindungan dan kesempatan bagi anak untuk berkembang adalah pertaruhan masa depan bangsa. https://t.co/d5nhEdZCjk";83;399;1387;10225;in;366987179;1682924817799061505;jokowi;https://twitter.com/jokowi/status/1682924817799061505
Sat Jul 22 06:10:51 +0000 2023;1682634291916988417;"Hari Bhakti Adhyaksa ke-63 diperingati saat kepercayaan publik terhadap kejaksaan sedang tinggi.   Salah satu lembaga survei menyampaikan, tingkat kepercayaan publik terhadap kejaksaan pada Agustus 2022 mencapai 75,3% dan meningkat jadi 81,2% pada Juli 2023. Selamat. https://t.co/gjWtqgTXsT";11;140;352;2827;in;366987179;1682634291916988417;jokowi;https://twitter.com/jokowi/status/1682634291916988417
Fri Jul 21 13:02:16 +0000 2023;1682375438558195712;"Pemerintah menargetkan, tingkat stunting nasional pada 2024 dapat berada di bawah 14%. Upaya untuk mencapai target tersebut akan didukung dengan anggaran yang cukup dari pemerintah. https://t.co/uD20QAfyAp";1;21;63;690;in;366987179;1682375406647934977;jokowi;https://twitter.com/jokowi/status/1682375438558195712
Fri Jul 21 13:02:08 +0000 2023;1682375406647934977;"Mengunjungi Posyandu Sarimulyo, Kab. Seluma, Bengkulu dan melihat langsung kegiatan pemeriksaan fisik terhadap bayi dan balita yang datang.   Pemeriksaan fisik yang rutin tersebut dilakukan untuk memastikan anak-anak tetap tumbuh dengan sehat. https://t.co/d2l24MVb8o";5;66;245;1754;in;366987179;1682375406647934977;jokowi;https://twitter.com/jokowi/status/1682375406647934977
Fri Jul 21 08:59:21 +0000 2023;1682314308519358465;"Pemerintah daerah tidak perlu takut membelanjakan anggaran, selama anggaran itu digunakan dengan baik dan bijak.  Lagipula, kenapa takut? Kalau nggak "ngambil", tak perlu takut. Kalau "ngambil", itu lain soal. https://t.co/e3yzXHLpHS";48;297;505;3547;in;366987179;1682314308519358465;jokowi;https://twitter.com/jokowi/status/1682314308519358465
Fri Jul 21 08:57:46 +0000 2023;1682313907418066944;"Meninjau Jalan Inpres Jalur Kerkap-Tanjung Agung Pali, di Kab. Bengkulu Utara, pada hari ketiga kunjungan kerja di Bengkulu.   Dapat saya pastikan, perbaikan infrastruktur jalan nasional, provinsi, dan kabupaten di Provinsi Bengkulu sudah dimulai. https://t.co/INSheqjQJ3";4;72;262;1892;in;366987179;1682313907418066944;jokowi;https://twitter.com/jokowi/status/1682313907418066944
Fri Jul 21 08:33:34 +0000 2023;1682307820216287232;"Salat Jumat di Masjid Al Jihad Tanjung Agung, Bengkulu, hari ini.   Masih dalam suasana Tahun Baru Islam, khatib menyampaikan khotbah mengenai hikmah berhijrah. https://t.co/tnfeRtvwQo";4;58;235;2384;in;366987179;1682307820216287232;jokowi;https://twitter.com/jokowi/status/1682307820216287232
Fri Jul 21 08:10:49 +0000 2023;1682302093087096832;"Berkunjung ke Pasar Purwodadi, pasar di Kab. Bengkulu Utara yang hendak direvitalisasi pasca kebakaran pada bulan April 2021.   Rencana revitalisasi Pasar Purwodadi masih dalam proses lelang. Semoga bisa dimulai Agustus atau September ini, dan diselesaikan awal tahun 2024. https://t.co/xQZz2UBHnM";2;30;226;1501;in;366987179;1682302093087096832;jokowi;https://twitter.com/jokowi/status/1682302093087096832
