created_at;id_str;full_text;quote_count;reply_count;retweet_count;favorite_count;lang;user_id_str;conversation_id_str;username;tweet_url
Wed Mar 29 15:38:19 +0000 2023;1641102495220121600;"Dalam kunjungan ke Kab. Maros, Sulawesi Selatan tadi, saya mendatangi Kampung Nelayan Desa Pajukukang. Para nelayan mengungkapkan adanya soal perizinan, konflik antarnelayan, hingga soal alat tangkap.  Persoalan-persoalan yang mereka hadapi, sekecil apapun, harus diselesaikan. https://t.co/quEkj0cFJp";9;84;138;1293;in;366987179;1641102495220121600;jokowi;https://twitter.com/jokowi/status/1641102495220121600
Wed Mar 29 12:49:14 +0000 2023;1641059942034731008;"Bersama Ibu Negara menjajal Kereta Api Lintas Makassar-Parepare dari Depo Kereta Api Maros menuju Stasiun Rammang-Rammang di Kab. Maros, siang tadi. Kereta berhenti sejenak di Stasiun Maros menjemput sejumlah anak SD dan SMP.  Selamat menikmati moda transportasi baru di Sulawesi. https://t.co/UnvXFmrwDx";29;63;252;2171;in;366987179;1641059942034731008;jokowi;https://twitter.com/jokowi/status/1641059942034731008
Wed Mar 29 12:46:20 +0000 2023;1641059211428909056;"Kereta api lintas Makassar-Parepare berada di jalur Trans-Sulawesi yang nantinya sambung menyambung sampai Sulawesi Utara.   Kereta api akan menjadi pilihan yang tepat bagi masyarakat dan pengusaha sebagai alat transportasi penumpang dan barang dengan tarif yang terjangkau. https://t.co/ZgOzX4lmSA";1;8;75;715;in;366987179;1641059204235681794;jokowi;https://twitter.com/jokowi/status/1641059211428909056
Wed Mar 29 12:46:18 +0000 2023;1641059204235681794;"Pengoperasian kereta api lintas Makassar-Parepare dengan trayek awal dari Maros ke Barru saya resmikan hari ini. Dan inilah kereta api pertama di Pulau Sulawesi.   Karena itulah, saya sangat senang dan menghargai apa yang sudah kita mulai ini. https://t.co/ICKESZZVSm";17;54;287;2782;in;366987179;1641059204235681794;jokowi;https://twitter.com/jokowi/status/1641059204235681794
Wed Mar 29 10:00:59 +0000 2023;1641017599487258624;"Berkunjung ke Pasar Tramo, Kab. Maros Sulawesi Selatan, mengecek harga beras dan kebutuhan pokok lainnya, seraya membagikan bantuan sosial bagi para pedagang.  Sulawesi Selatan, termasuk di Kab. Maros, adalah daerah lumbung beras. https://t.co/p9zVIdTQN4";7;61;192;1557;in;366987179;1641017599487258624;jokowi;https://twitter.com/jokowi/status/1641017599487258624
Wed Mar 29 04:22:46 +0000 2023;1640932487223468033;"Aga kareba, Sulawesi Selatan? Saya baru tiba di Pangkalan TNI AU Sultan Hasanuddin, Kab. Maros.   Kedatangan saya hari ini terutama untuk meresmikan pengoperasian Jalur Kereta Api Lintas Makassar-Parepare Antar Maros-Barru sekaligus menjajal kereta api pertama di Sulawesi ini. https://t.co/E2rdNeYOA8";39;166;401;3751;in;366987179;1640932487223468033;jokowi;https://twitter.com/jokowi/status/1640932487223468033
Tue Mar 28 14:03:07 +0000 2023;1640716148504432642;"Indonesia konsisten mendukung kemerdekaan Palestina dan penyelesaian two states solution. Terkait Indonesia menjadi tuan rumah Piala Dunia U-20 dan timnas Israel lolos seleksi di ajang tersebut, pemerintah dan PSSI masih terus berusaha agar ada solusi.  https://t.co/oiyDQ7L7HS";100;402;497;2814;in;366987179;1640716148504432642;jokowi;https://twitter.com/jokowi/status/1640716148504432642
Tue Mar 28 12:59:59 +0000 2023;1640700258522136577;"Saya mengimbau seluruh umat Islam, khususnya pejabat-pejabat negara dan daerah, ASN, dan BUMN, untuk berzakat melalui Baznas sehingga dana zakat dapat dikelola dengan profesional.  Semoga zakat yang kita keluarkan menyempurnakan ibadah puasa dan ketakwaan kita kepada Allah SWT. https://t.co/sRmPJibAvv";3;23;84;774;in;366987179;1640700241937829889;jokowi;https://twitter.com/jokowi/status/1640700258522136577
Tue Mar 28 12:59:55 +0000 2023;1640700241937829889;"Hari ini, hari keenam bulan Ramadan, saya menunaikan kewajiban sebagai umat Islam dengan menyerahkan zakat melalui Badan Amil Zakat Nasional (Baznas) di Istana Negara. Penyerahan zakat ini juga wujud rasa syukur atas segala nikmat yang diberikan Allah SWT. https://t.co/8M33UlwoIb";10;88;241;2679;in;366987179;1640700241937829889;jokowi;https://twitter.com/jokowi/status/1640700241937829889
Mon Mar 27 12:56:31 +0000 2023;1640337001756119040;"Jajaran pemerintah menyambut bulan puasa tahun ini hendaknya dengan semangat kesederhanaan. Tidak berlebih-lebihan. https://t.co/4SF5Dz78bv";51;336;488;4116;in;366987179;1640337001756119040;jokowi;https://twitter.com/jokowi/status/1640337001756119040
Wed Mar 22 12:54:50 +0000 2023;1638524637217959936;"Marhaban ya Ramadan. Selamat datang bulan Ramadan -- bulan penuh rahmat, pahala, dan pengampunan.   Selamat menunaikan ibadah puasa bagi seluruh umat Islam. https://t.co/4Vugi4Y8Nk";1269;1957;9526;74677;in;366987179;1638524637217959936;jokowi;https://twitter.com/jokowi/status/1638524637217959936
Wed Mar 22 01:23:31 +0000 2023;1638350662387003392;"Dalam hening dan sepi, kita berserah diri. Semoga kebahagiaan dan kedamaian senantiasa memayungi.  Selamat Hari Raya Nyepi 2023. https://t.co/YLEO5ptYNB";26;140;685;5364;in;366987179;1638350662387003392;jokowi;https://twitter.com/jokowi/status/1638350662387003392
Tue Mar 21 13:30:17 +0000 2023;1638171168795684868;"Hasil penanaman hari ini diharapkan bisa dipanen pada bulan Juni. Saya mendorong agar hasil dari penanaman jagung di food estate Kab. Keerom dimanfaatkan secara maksimal untuk memenuhi kebutuhan pakan ternak di Papua. https://t.co/0dPtp0birs";9;40;86;894;in;366987179;1638171147966771211;jokowi;https://twitter.com/jokowi/status/1638171168795684868
Tue Mar 21 13:30:12 +0000 2023;1638171147966771211;"Pemerintah menyiapkan lahan sekitar 10 ribu ha untuk penanaman jagung di Kab. Keerom, Papua.   Saat saya mengunjungi area lumbung pangan tersebut hari ini, sudah disiapkan land clearing, kemudian pengolahan tanah 500 ha -- tahun depan 2.500 ha -- dan yang baru ditanami 100 ha. https://t.co/wQC3yRaR0t";60;200;288;2573;in;366987179;1638171147966771211;jokowi;https://twitter.com/jokowi/status/1638171147966771211
Tue Mar 21 13:29:22 +0000 2023;1638170941787357184;"Beberapa saat setiba di Jayapura, semalam, saya menggelar rapat terbatas bersama jajaran pengamanan wilayah Provinsi Papua. Saya  menekankan kepada seluruh jajaran TNI dan Polri agar mengawal pembangunan untuk meningkatkan kesejahteraan masyarakat di wilayah Papua. https://t.co/NlJ2jguWMs";11;57;161;1664;in;366987179;1638170941787357184;jokowi;https://twitter.com/jokowi/status/1638170941787357184
Tue Mar 21 10:45:35 +0000 2023;1638129722197704705;"Mengunjungi Pasar Youtefa Lama di Kota Jayapura, siang ini. Saya berkeliling pasar, berbincang dengan beberapa pedagang seraya mengecek harga-harga kebutuhan pokok dan membagi bantuan sosial. https://t.co/33ZvJ5qKsn";4;51;146;1402;in;366987179;1638129722197704705;jokowi;https://twitter.com/jokowi/status/1638129722197704705
Tue Mar 21 10:40:14 +0000 2023;1638128375062761478;"Karena itu, pemerintah mendukung penuh pembangunan ruang kreatif (creative hub) di daerah lain di Tanah Air. Creative hub seperti ini bisa juga dibuat di NTT, Maluku, sampai Aceh. Tentu dengan sedikit modifikasi sesuai keinginan anak-anak muda provinsi-provinsi tadi. https://t.co/6mqw6WFa9x";1;6;55;596;in;366987179;1638128363721347072;jokowi;https://twitter.com/jokowi/status/1638128375062761478
Tue Mar 21 10:40:11 +0000 2023;1638128363721347072;"Papua Youth Creative Hub (PYCH) di Jayapura betul-betul bagus dan memberi manfaat nyata bagi generasi muda di Tanah Papua.   Di dalamnya ada kegiatan yang berkaitan dengan peternakan, perikanan, industri grafik, aplikasi platform, fesyen, musik, fotografi, dan lain-lain. https://t.co/YhzcaTklvD";3;32;158;1804;in;366987179;1638128363721347072;jokowi;https://twitter.com/jokowi/status/1638128363721347072
Tue Mar 21 09:41:17 +0000 2023;1638113542158307330;"Oleh sebab itu, saya meminta kepada masyarakat di Tanah Papua untuk mengawal pembangunan di daerah mereka. https://t.co/exKuyHtwzy";2;9;67;773;in;366987179;1638112347574386688;jokowi;https://twitter.com/jokowi/status/1638113542158307330
Tue Mar 21 09:36:35 +0000 2023;1638112356298551297;"Pemerintah telah membangun jalan, jembatan, bandara, hingga pos lintas batas negara.   Kita membangun Jalan Trans-Papua sepanjang 3.462 kilometer, jalan perbatasan 1.098 kilometer, Jembatan Youtefa 1,3 kilometer, terminal Bandara Domine Eduard Osok di Sorong, dan sebagainya. https://t.co/jPTfGrF3cZ";5;15;86;926;in;366987179;1638112347574386688;jokowi;https://twitter.com/jokowi/status/1638112356298551297
Tue Mar 21 09:36:32 +0000 2023;1638112347574386688;"Pembangunan Indonesia sekarang bukan jawasentris tetapi indonesiasentris, dan Papua jadi prioritas. Pembangunan infrastruktur di Papua telah menghabiskan anggaran tidak sedikit.   Dari pemerintah pusat, provinsi, kab/kota telah keluar Rp1.036 triliun untuk pembangunan di Papua. https://t.co/PCiIggYQ72";23;155;385;3658;in;366987179;1638112347574386688;jokowi;https://twitter.com/jokowi/status/1638112347574386688
Tue Mar 21 09:30:17 +0000 2023;1638110772722282496;"Meresmikan Papua Youth Creative Hub (PYCH), sebuah fasilitas yang dibangun di Kota Jayapura untuk menunjang minat, bakat, dan kreativitas anak-anak muda di Tanah Papua.   Kehadiran PYCH telah berdampak baik bagi usaha dan kegiatan para pemuda Papua. Semoga semakin bermanfaat. https://t.co/BmjU2Ftv6y";7;32;158;1498;in;366987179;1638110772722282496;jokowi;https://twitter.com/jokowi/status/1638110772722282496
Mon Mar 20 13:22:14 +0000 2023;1637806755936862209;"Terbang dari Jakarta pukul 12.50 WIB, saya akhirnya tiba di Bandar Udara Sentani, Kabupaten Jayapura, Papua sekitar pukul 19.45 WIT malam ini.  Besok pagi, saya memulai kunjungan kerja, salah satunya meresmikan Papua Youth Creative Hub (PYCH) di Jayapura. https://t.co/Rdcm5npqFr";17;141;332;3125;in;366987179;1637806755936862209;jokowi;https://twitter.com/jokowi/status/1637806755936862209
Mon Mar 20 10:15:08 +0000 2023;1637759671833624577;"Selamat bekerja Bapak Anwar Usman dan Bapak Saldi Isra sebagai Ketua dan Wakil Ketua Mahkamah Konstitusi masa jabatan 2023-2028. https://t.co/L2eX3k7Wnj";20;140;178;2127;in;366987179;1637759671833624577;jokowi;https://twitter.com/jokowi/status/1637759671833624577
Mon Mar 20 08:56:24 +0000 2023;1637739857262034944;"Hari ini di Jakarta, saya menghadiri acara Penyerahan Penghargaan Penanganan Covid-19 seraya mengajak seluruh komponen bangsa untuk terus melanjutkan keberhasilan ini ke berbagai masalah kemanusiaan dan kebangsaan dan membangun Indonesia menjadi negara maju. https://t.co/RqERo1YqeD";6;16;56;616;in;366987179;1637739843848650752;jokowi;https://twitter.com/jokowi/status/1637739857262034944
Mon Mar 20 08:56:21 +0000 2023;1637739843848650752;"Seluruh komponen bangsa telah bekerja keras melampaui tugas dan fungsinya dalam menangani Covid-19. Permasalahan besar lainnya akan dapat diselesaikan apabila kerja keras seperti saat menghadapi masalah Covid-19 terus diimplementasikan. https://t.co/o15QPwTVFU";12;63;198;2101;in;366987179;1637739843848650752;jokowi;https://twitter.com/jokowi/status/1637739843848650752
Mon Mar 20 03:07:04 +0000 2023;1637651946034331648;"Dua ganda putra Indonesia, Fajar Alfian/Muhammad Rian Ardianto dan Mohammad Ahsan/Hendra Setiawan berhadapan di final kejuaraan bulutangkis All England 2023, semalam.   Selamat kepada Fajar/Rian yang tampil sebagai juara, juga untuk Ahsan/Hendra yang telah berjuang luar biasa. https://t.co/n4HU3Csn9M";24;67;699;5535;in;366987179;1637651946034331648;jokowi;https://twitter.com/jokowi/status/1637651946034331648
Sat Mar 18 11:01:43 +0000 2023;1637046618292899840;"Untuk pertama kalinya, saya berkunjung ke Tabalong, sebuah kabupaten di Kalimantan Selatan. Masyarakatnya ramah-ramah. Kotanya asyik. Di sini, saya bertemu tokoh adat dan agama, datang ke pasar, juga meresmikan proyek-proyek infrastruktur. https://t.co/LkXb3jv1YD";35;184;404;3887;in;366987179;1637046618292899840;jokowi;https://twitter.com/jokowi/status/1637046618292899840
Fri Mar 17 12:13:37 +0000 2023;1636702325195800577;"Sistem Penyediaan Air Minum (SPAM) Banjarbakula di Kota Banjarbaru, Kalimantan Selatan, yang saya resmikan hari ini, dapat memasok air minum ke lebih 60.000 sambungan rumah.   SPAM Banjarbakula mengolah air dari Sungai Riam Kanan lalu disalurkan 5 daerah di Kalimantan Selatan. https://t.co/d46uCVzEjs";6;84;169;1439;in;366987179;1636702325195800577;jokowi;https://twitter.com/jokowi/status/1636702325195800577
Fri Mar 17 10:19:38 +0000 2023;1636673641541959681;"Meresmikan Jalan Nan Sarunai Ruas Simpang 4 Islamic Center - Tanjung Selatan di Kab. Tabalong, siang ini. Jalan sepanjang 4,2 km dengan 12 jembatan ini dibangun setahun dengan dana Pemulihan Ekonomi Nasional.  Semoga dapat membantu menggerakkan perekonomian di Kab. Tabalong. https://t.co/2erRZvYkLA";14;80;222;2206;in;366987179;1636673641541959681;jokowi;https://twitter.com/jokowi/status/1636673641541959681
Fri Mar 17 08:29:08 +0000 2023;1636645833885229056;"Meninjau Pasar Rakyat Tabalong di Kalsel seraya mengecek harga kebutuhan pokok dan membagi bantuan sosial.  Ini kunjungan pertama saya ke Kab. Tabalong. Saya berharap keberadaan Ibu Kota Nusantara akan meningkatkan pertumbuhan ekonomi di sekitar IKN, salah satunya Kab. Tabalong. https://t.co/4Agq3d8VHr";9;44;135;1260;in;366987179;1636645833885229056;jokowi;https://twitter.com/jokowi/status/1636645833885229056
Fri Mar 17 07:10:37 +0000 2023;1636626074766573568;"Bersilaturahmi dengan para tokoh agama dan tokoh adat di Kab. Tabalong, Kalimantan Selatan, siang ini.  Sekarang atau di masa datang, apabila pemimpin-pemimpin didukung oleh para alim ulama, saya yakin negara ini akan menjadi negara besar, secara ekonomi dan yang lain-lainnya. https://t.co/Anm2rCTO15";5;56;166;1506;in;366987179;1636626074766573568;jokowi;https://twitter.com/jokowi/status/1636626074766573568
Fri Mar 17 07:06:59 +0000 2023;1636625159808483330;"Terima kasih dan penghargaan yang tinggi atas dukungan masyarakat Melayu-Banjar terhadap pembangunan Ibu Kota Nusantara. Saya berharap masyarakat Melayu-Banjar terus berperan aktif dalam pembangunan IKN.  IKN dibangun untuk mewujudkan pembangunan yang merata di seluruh Indonesia. https://t.co/qVhSZxcULY";7;28;115;1150;in;366987179;1636625159808483330;jokowi;https://twitter.com/jokowi/status/1636625159808483330
Fri Mar 17 07:04:33 +0000 2023;1636624545514917888;"Sebagai bangsa besar kita diikat dengan dengan konsensus kebangsaan yaitu Pancasila, UUD 1945, NKRI dan Bhinneka Tunggal Ika.  Saya mengajak masyarakat Melayu-Banjar untuk bersama meningkatkan semangat ukhuwah, dan menjadikan masyarakat hidup rukun meski di tengah perbedaan. https://t.co/EuSMtOXPbz";2;15;69;591;in;366987179;1636624520768524289;jokowi;https://twitter.com/jokowi/status/1636624545514917888
Fri Mar 17 07:04:27 +0000 2023;1636624520768524289;"Istigasah dan Doa Bersama Rabithah Melayu-Banjar di Komplek Pendopo Bersinar Tabalong, Kalimantan Selatan, hari ini begitu meriah. Ini menunjukkan tingginya antusiasme dan semangat masyarakat Melayu-Banjar dalam menjunjung tinggi nilai-nilai agama dan adat tradisi ketimuran. https://t.co/NNfsIFzY4b";5;31;196;2216;in;366987179;1636624520768524289;jokowi;https://twitter.com/jokowi/status/1636624520768524289
Fri Mar 17 01:25:13 +0000 2023;1636539148776673283;"Saya telah berada di Kota Banjarbaru, Kalimantan Selatan, sejak kemarin sore, sepulang dari Singapura.   Hari ini, saya menuju Kabupaten Tabalong untuk menghadiri acara Istigasah dan Doa Bersama Rabithah Melayu-Banjar, dan beberapa agenda lain sampai sore hari. https://t.co/YryyAVO4pF";21;122;270;2972;in;366987179;1636539148776673283;jokowi;https://twitter.com/jokowi/status/1636539148776673283
Fri Mar 17 01:23:08 +0000 2023;1636538624606101505;"Mereka tidak datang sekadar memberi senyum yang tulus, sikap sabar, atau menularkan semangat. Mereka hadir memberi pelayanan profesional yang membangunkan harapan.   Para perawat Indonesia telah membuat dunia menjadi tempat yang lebih baik bagi setiap orang yang membutuhkan. https://t.co/vZzn9T4e5t";75;158;618;5166;in;366987179;1636538624606101505;jokowi;https://twitter.com/jokowi/status/1636538624606101505
Thu Mar 16 11:16:02 +0000 2023;1636325447247237122;"Saya dan PM Lee sepakat memperkuat implementasi perjanjian itu dengan tindak lanjut seperti memperbarui MoU antarkejaksaan, menyelesaikan MoU antarkepolisian, membentuk defence cooperation committee, dan membuat aturan teknis pelaksanaan perjanjian FIR, pertahanan dan ekstradisi. https://t.co/YrDV9cTB7H";4;16;82;757;in;366987179;1636325428888768512;jokowi;https://twitter.com/jokowi/status/1636325447247237122
Thu Mar 16 11:16:00 +0000 2023;1636325437176680450;"Di bidang politik, hukum, dan keamanan, ratifikasi tiga perjanjian telah diselesaikan antara lain persetujuan flight information region (FIR), perjanjian ekstradisi, dan perjanjian kerja sama pertahanan. https://t.co/Y8N35w2OD7";5;21;89;749;in;366987179;1636325428888768512;jokowi;https://twitter.com/jokowi/status/1636325437176680450
Thu Mar 16 11:15:58 +0000 2023;1636325428888768512;"Pertemuan bilateral dengan Perdana Menteri Singapura Lee Hsien Loong telah selesai.  Ada banyak kemajuan yang telah kita lakukan sejak pertemuan di Bintan, Januari 2022. Misalnya, investasi Singapura ke Indonesia naik 40% dan volume perdagangan di antara kedua negara naik 25%. https://t.co/DYWHYD0Ata";8;80;229;2204;in;366987179;1636325428888768512;jokowi;https://twitter.com/jokowi/status/1636325428888768512
Thu Mar 16 06:08:01 +0000 2023;1636247931044130816;"Tiba di Istana Kepresidenan Singapura dan disambut langsung Perdana Menteri Lee Hsien Loong. Kami memperkenalkan anggota delegasi masing-masing. Saya dan PM Lee kemudian menuju ke Kantor Perdana Menteri untuk melakukan pertemuan informal pada hari ini. https://t.co/NkRM1OODIh";8;67;236;2611;in;366987179;1636247931044130816;jokowi;https://twitter.com/jokowi/status/1636247931044130816
Thu Mar 16 03:43:15 +0000 2023;1636211500082925568;"Pagi ini saya menuju Singapura untuk bertemu dengan Perdana Menteri Lee Hsien Loong.  Setahun yang lalu, PM Lee yang datang ke Indonesia menghadiri pertemuan tahunan di Bintan, Kepulauan Riau. Tahun ini, Leaders' Retreat digelar di Singapura. https://t.co/A1ImvRuXuP";14;65;211;1954;in;366987179;1636211500082925568;jokowi;https://twitter.com/jokowi/status/1636211500082925568
Wed Mar 15 08:25:39 +0000 2023;1635920180474953728;"Saat ini sudah jauh lebih banyak produk dalam negeri masuk dalam e-katalog. Jangan hanya dilihat, tapi dibeli oleh kementerian/lembaga, pemerintah daerah, hingga BUMN/BUMD.  Pemerintah menargetkan 95% dari pagu anggaran pengadaan barang dan jasa dibelikan produk dalam negeri. https://t.co/d0z2uSxNjM";5;29;90;716;in;366987179;1635920166067539974;jokowi;https://twitter.com/jokowi/status/1635920180474953728
Wed Mar 15 08:25:36 +0000 2023;1635920166067539974;"Pendapatan negara dalam APBN dikumpulkan dengan tidak mudah dari berbagai sumber: pajak, dividen, royalti, hingga penerimaan negara bukan pajak. Karena itulah, saya selalu mengingatkan jajaran pemerintah agar tidak mempergunakan anggaran dalam APBN untuk berbelanja produk impor. https://t.co/EpTPzvQwcE";35;289;330;2523;in;366987179;1635920166067539974;jokowi;https://twitter.com/jokowi/status/1635920166067539974
Tue Mar 14 13:21:57 +0000 2023;1635632358077636608;"Selesai sudah proses pencocokan dan penelitian atau coklit data pemilih untuk saya hari ini. Nama saya terdaftar sebagai pemilih pada Pemilu 2024 di TPS nomor 10 Kelurahan Gambir.  Saya mengimbau masyarakat untuk segera melakukan pengecekan data pemilih di situs resmi KPU. https://t.co/DMqlHgT3C3";11;50;117;820;in;366987179;1635632347910635520;jokowi;https://twitter.com/jokowi/status/1635632358077636608
Tue Mar 14 13:21:54 +0000 2023;1635632347910635520;"Hari ini saya menerima petugas pemutakhiran data pemilih dari Kelurahan Gambir, Jakarta Pusat.    Setelah memperlihatkan KTP dan KK untuk dicocokkan dengan data, saya pun mendapatkan tanda bukti pendaftaran dan stiker coklit untuk ditempelkan di pintu kediaman sesuai alamat. https://t.co/eojfvqk5LV";45;206;320;2990;in;366987179;1635632347910635520;jokowi;https://twitter.com/jokowi/status/1635632347910635520
Tue Mar 14 09:44:53 +0000 2023;1635577732766797824;"KTT ASEAN ini juga akan kita manfaatkan jadi ajang promosi Labuan Bajo sebagai salah satu destinasi superprioritas pariwisata Indonesia. https://t.co/Kxcb7b9jgb";4;6;82;692;in;366987179;1635577723614806017;jokowi;https://twitter.com/jokowi/status/1635577732766797824
Tue Mar 14 09:44:51 +0000 2023;1635577723614806017;"Indonesia menjadi tuan rumah KTT ASEAN ke-42 pada bulan Mei mendatang. KTT akan digelar di Labuan Bajo, NTT.  Hari ini, saya meninjau sejumlah lokasi untuk  KTT ASEAN ke-42 tersebut. Beberapa venue lokasi KTT sudah siap, tinggal beberapa sentuhan kecil di sana-sini. https://t.co/KezXXsOun4";15;92;328;2854;in;366987179;1635577723614806017;jokowi;https://twitter.com/jokowi/status/1635577723614806017
Mon Mar 13 18:49:23 +0000 2023;1635352369897816066;"Tempat pengolahan sampah terpadu (TPST) Kesiman Kertalangu di Kota Denpasar yang saya resmikan hari ini merupakan tempat pengolahan sampah pertama pertama yang saya lihat menggunakan sistem yang sederhana tapi hasilnya nyata. Patut diterapkan di daerah lain di Indonesia. https://t.co/RQgzkgYLR5";14;57;165;1336;in;366987179;1635352369897816066;jokowi;https://twitter.com/jokowi/status/1635352369897816066
Mon Mar 13 15:02:36 +0000 2023;1635295299060252680;"Pura ini harus kita jaga, kita rawat dengan penuh hormat, sehingga umat Hindu dan pengunjung yang datang bisa merasakan aura kesuciannya, terjaga kebersihan dan kerapiannya, sekaligus menjadi tempat yang indah. https://t.co/HFKyrPrK1V";4;12;88;957;in;366987179;1635295270207635458;jokowi;https://twitter.com/jokowi/status/1635295299060252680
Mon Mar 13 15:02:32 +0000 2023;1635295281645506561;"Hari ini, pekerjaan besar itu telah selesai. Penataan kawasan Pura Besakih meliputi pembangunan gedung parkir, 267 kios besar dan 198 kios kecil, pedestrian, hingga fasilitas umum seperti toilet, Bale Pesandekan, Bale Gong, dan area bermain anak. https://t.co/Gj2JPoPsZb";5;15;95;950;in;366987179;1635295270207635458;jokowi;https://twitter.com/jokowi/status/1635295281645506561
Mon Mar 13 15:02:29 +0000 2023;1635295270207635458;"Meresmikan penataan kawasan Pura Agung Besakih di Kab. Karangasem, Bali, hari ini. Pura ini selalu dipadati pengunjung, apalagi jika ada upacara besar, yang bisa menimbulkan kesemrawutan dan ketidaknyamanan.  Maka, tahun 2021 pemerintah melakukan penataan kawasan Pura Besakih. https://t.co/CNA9Fjz0ph";8;52;235;2225;in;366987179;1635295270207635458;jokowi;https://twitter.com/jokowi/status/1635295270207635458
Mon Mar 13 09:04:02 +0000 2023;1635205063894523909;"Perjalanan menuju kawasan suci Pura Agung Besakih di Kabupaten Karangasem, Bali, siang ini. Terima kasih untuk sambutan dan kehangatan masyarakat Bali. https://t.co/cN4WlfG8Rv";15;136;298;3250;in;366987179;1635205063894523909;jokowi;https://twitter.com/jokowi/status/1635205063894523909
Mon Mar 13 05:47:56 +0000 2023;1635155715332636673;"Tiba di Bandara Internasional I Gusti Ngurah Rai pagi ini untuk kunjungan kerja di Bali. Hari ini saya hendak meresmikan fasilitas kawasan suci Pura Agung Besakih, kemudian menuju Kota Denpasar untuk meninjau Tempat Pengolahan Sampah Terpadu (TPST) Kesiman Kertalangu. https://t.co/gLZyVxfP4w";4;70;188;1925;in;366987179;1635155715332636673;jokowi;https://twitter.com/jokowi/status/1635155715332636673
Sun Mar 12 10:16:00 +0000 2023;1634860786710642688;"Turut berdukacita yang dalam atas berpulangnya Ibu Koesni Harningsih pada hari ini di Jakarta. Semoga almarhumah mendapat tempat nan lapang di sisi Allah SWT. Kepada suami almh., Bapak Moeldoko, Kepala Staf Kepresidenan dan segenap keluarga besar almh. kiranya sabar dan ikhlas. https://t.co/mnJ5S5Djb5";8;310;367;3492;in;366987179;1634860786710642688;jokowi;https://twitter.com/jokowi/status/1634860786710642688
Sat Mar 11 15:18:07 +0000 2023;1634574430524542976;"Berkunjung ke persawahan Desa Kartoharjo, Kabupaten Ngawi, Jawa Timur, dan menyaksikan para petani melaksanakan panen raya. https://t.co/m0mLXUttja";22;138;244;2180;in;366987179;1634574430524542976;jokowi;https://twitter.com/jokowi/status/1634574430524542976
Sat Mar 11 08:10:13 +0000 2023;1634466744927666176;"Kita juga ingin ada keseimbangan harga di antara petani, penjual, dan masyarakat. Harga di petani, pedagang, dan masyarakat wajar dan menguntungkan semua.   Untuk mendorong keseimbangan harga, saya meminta Bulog untuk menjaga stok cadangan beras pemerintah sebanyak 2,4 juta ton. https://t.co/lncUIgI3wq";2;19;71;532;in;366987179;1634466736467763200;jokowi;https://twitter.com/jokowi/status/1634466744927666176
Sat Mar 11 08:10:11 +0000 2023;1634466736467763200;"Panen raya padi sudah dimulai di beberapa daerah di Tanah Air. Untuk itu saya meminta Badan Urusan Logistik (Bulog) dapat menyerap gabah sebanyak-banyaknya dari petani dengan harga GKP (gabah kering panen) yang ideal sesuai yang nanti ditentukan oleh Badan Pangan Nasional. https://t.co/Fo8VOEoRJZ";5;81;162;1396;in;366987179;1634466736467763200;jokowi;https://twitter.com/jokowi/status/1634466736467763200
Sat Mar 11 07:34:05 +0000 2023;1634457649847869442;"Sebanyak 10 sentra penggilingan padi milik Bulog telah dibangun di Tanah Air. Tujuh di antaranya sudah beroperasi yaitu di Subang, Kendal, Karawang, Lampung, Bojonegoro, Magetan, dan Sragen.  Sentra-sentra penggilingan padi akan dapat memperkuat Bulog menyerap gabah dari petani. https://t.co/wo4jOuQbp4";4;12;73;557;in;366987179;1634457634014380038;jokowi;https://twitter.com/jokowi/status/1634457649847869442
