created_at;id_str;full_text;quote_count;reply_count;retweet_count;favorite_count;lang;user_id_str;conversation_id_str;username;tweet_url
Sat May 20 02:51:04 +0000 2023;1659753577953513475;"Mengenai perdagangan, Indonesia telah memberikan fleksibilitas untuk produk pertanian dari Fukushima. Saya minta fleksibilitas Jepang terkait perluasan akses buah tropis Indonesia.  Terkait investasi, diperlukan percepatan penyelesaian proyek pembangunan MRT di Indonesia.";1;5;65;435;in;366987179;1659753571016138752;jokowi;https://twitter.com/jokowi/status/1659753577953513475
Sat May 20 02:51:03 +0000 2023;1659753574241562624;"Dalam pertemuan tadi, kami membahas mengenai Indonesia-Japan Economic Partnership Agreement agar bisa selesai September 2023. IJEPA ini mencakup penghapusan tarif produk tuna kaleng, perluasan bidang kerja PMI di sektor pariwisata dan industri, dan implementasi capacity building.";1;2;47;242;in;366987179;1659753571016138752;jokowi;https://twitter.com/jokowi/status/1659753574241562624
Sat May 20 02:51:02 +0000 2023;1659753571016138752;"Pertemuan bilateral dengan PM Jepang Fumio Kishida di Hotel Grand Prince, Hiroshima, hari ini. Terima kasih atas undangan Yang Mulia untuk menghadiri KTT G7.   Jepang adalah mitra penting dan strategis Indonesia. Kemitraan itu perlu ditingkatkan agar lebih luas dan konkret. https://t.co/an5tNLi6Lu";17;78;340;2912;in;366987179;1659753571016138752;jokowi;https://twitter.com/jokowi/status/1659753571016138752
Sat May 20 02:35:13 +0000 2023;1659749589132644353;"Hari kedua di Hiroshima, saya akan melakukan pertemuan bilateral dengan PM Jepang Fumio Kishida, lalu PM Inggris Rishi Sunak, kemudian dengan pemimpin negara sahabat lain.  Sore hari, saya dan Ibu Negara akan menghadiri penyambutan resmi negara mitra G7 oleh tuan rumah KTT G7. https://t.co/9Tcmw6smjz";7;39;204;1789;in;366987179;1659749589132644353;jokowi;https://twitter.com/jokowi/status/1659749589132644353
Sat May 20 01:48:19 +0000 2023;1659737788055691264;"Betapapun besarnya tantangan yang kita hadapi sebagai sebuah bangsa, takkan menghentikan langkah Indonesia untuk maju.   Syaratnya adalah semangat, kerja keras, dan bersatu, lalu melaju melewati setiap tantangan itu untuk berdiri tegak sejajar dengan bangsa-bangsa maju lainnya. https://t.co/fu08EswRqC";66;324;966;7596;in;366987179;1659737788055691264;jokowi;https://twitter.com/jokowi/status/1659737788055691264
Fri May 19 11:30:57 +0000 2023;1659522021930471426;"Cuaca cerah di langit Hiroshima saat pesawat kami mendarat di Bandara Internasional Hiroshima pukul 17.45 waktu setempat, usai menempuh penerbangan enam jam dari Jakarta.   Saya dan Ibu Negara bermalam di kota ini untuk menghadiri KTT G7 dengan negara-negara mitra, esok hari. https://t.co/bhfxgIizOz";35;202;521;5481;in;366987179;1659522021930471426;jokowi;https://twitter.com/jokowi/status/1659522021930471426
Fri May 19 08:33:11 +0000 2023;1659477288248045573;"Para wartawan bertanya, bagaimana tanggapan saya terhadap kasus hukum yang dihadapi Menkominfo Johnny G. Plate.   Semua pihak harus menghormati proses hukum yang ada. Saya yakin Kejaksaan Agung bekerja dan bertindak profesional serta transparan dalam menangani kasus tersebut. https://t.co/pv8p0CGTBV";67;493;785;5232;in;366987179;1659477288248045573;jokowi;https://twitter.com/jokowi/status/1659477288248045573
Fri May 19 04:15:26 +0000 2023;1659412422049005574;"Selain menghadiri KTT G7, saya juga akan melakukan pertemuan bilateral dengan sejumlah pemimpin negara dan bertemu dengan beberapa pengusaha besar Jepang.";4;11;77;661;in;366987179;1659412413601677312;jokowi;https://twitter.com/jokowi/status/1659412422049005574
Fri May 19 04:15:25 +0000 2023;1659412417435279360;"Indonesia akan datang ke KTT G7 membawa suara dari negara-negara berkembang yang harus didengarkan di dalam forum tersebut.  Beberapa poin hasil dari KTT ke-42 ASEAN yang berlangsung di Labuan Bajo juga akan saya sampaikan di forum ini, misalnya yang berkaitan dengan Myanmar.";1;15;85;717;in;366987179;1659412413601677312;jokowi;https://twitter.com/jokowi/status/1659412417435279360
Fri May 19 04:15:24 +0000 2023;1659412413601677312;"Bersama Ibu Negara dan delegasi terbatas menuju Hiroshima, Jepang menghadiri KTT G7 dengan negara mitra atau G7 Outreach Summit 2023.  Di pertemuan itu akan dibahas masalah global seperti perubahan iklim, pangan, energi, dll. Indonesia ingin berkontribusi di bidang-bidang ini. https://t.co/w9hrNsukmy";60;291;764;8116;in;366987179;1659412413601677312;jokowi;https://twitter.com/jokowi/status/1659412413601677312
Thu May 18 03:32:39 +0000 2023;1659039269468672000;"Kedamaian, kesehatan, dan kebahagiaan adalah berkat dan nikmat dari Yang Maha Kuasa yang senantiasa kita syukuri.   Dengan rasa syukur itulah, kita bersama-sama bekerja keras untuk kemajuan bangsa kita dan kemaslahatan umat manusia. https://t.co/0L9KlvU4lX";67;312;1037;8756;in;366987179;1659039269468672000;jokowi;https://twitter.com/jokowi/status/1659039269468672000
Wed May 17 09:25:11 +0000 2023;1658765596241297408;"Saya melihat para siswa SMK ini praktik pembibitan tanaman kelapa sawit, serta meninjau kandang kambing tempat praktik peternakan.  Saya sudah menugaskan Menteri PUPR untuk memperbaiki kandang hewan di sekolah ini, membantu pembuatan irigasi, dan ruang green house. https://t.co/JHFlW3awy8";3;38;112;1052;in;366987179;1658765582953775105;jokowi;https://twitter.com/jokowi/status/1658765596241297408
Wed May 17 09:25:08 +0000 2023;1658765582953775105;"Berkunjung mendadak ke sebuah sekolah menengah kejuruan di Kab. Labuhanbatu Utara, Sumatra Utara. Saya ingin melihat kegiatan belajar mengajar dan praktik di sekolah itu, apa adanya. Nama sekolah ini SMK Pertanian Pembangunan Negeri 1 Kualuh Selatan. https://t.co/bHQt5SnDgK";9;120;350;3054;in;366987179;1658765582953775105;jokowi;https://twitter.com/jokowi/status/1658765582953775105
Wed May 17 07:53:24 +0000 2023;1658742498813186048;"Pemerintah akan memperbaiki jalan sesuai dengan skala prioritasnya. Jalan produksi dan jalan logistik yang rusak berat akan menjadi prioritas utama. https://t.co/5b0urmUNG0";7;45;138;1113;in;366987179;1658742461106356224;jokowi;https://twitter.com/jokowi/status/1658742498813186048
Wed May 17 07:53:19 +0000 2023;1658742476558200834;"Sebagaimana provinsi yang sebelumnya saya tinjau, pemerintah pusat juga akan memperbaiki infrastruktur jalan yang rusak di Sumatra Utara. Tentu perbaikannya dibagi dengan pemerintah daerah.   Yang diambil alih oleh pusat yaitu, yang kira-kira pemda tak mampu kerjakan sendiri. https://t.co/cEKucJIYAg";8;50;120;1142;in;366987179;1658742461106356224;jokowi;https://twitter.com/jokowi/status/1658742476558200834
Wed May 17 07:53:15 +0000 2023;1658742461106356224;"Panjang jalan nasional di Sumatra Utara 2.600 km, yang rusak kira-kira 260 km. Jalan provinsi 3.005 km, perlu perbaikan 340 km.   Jalan kabupaten panjangnya 33.000 km, sekitar 13.000 km di antaranya juga rusak. Salah satunya, ruas jalan Gunting Saga di Kab. Labuhanbatu Utara ini. https://t.co/T0bTLY5EsC";67;366;593;5182;in;366987179;1658742461106356224;jokowi;https://twitter.com/jokowi/status/1658742461106356224
Wed May 17 05:20:46 +0000 2023;1658704086081110016;"Berkunjung ke Jambi, kemarin, saya sengaja mampir mendadak di SMK Negeri 4 Kota Jambi di saat para siswa di sana sedang melaksanakan praktikum. Kepada siswa-siswa jurusan tata busana, saya memesan kemeja.   Satu dulu ya. Kirim ke istana. Kalau pas, buat satu lagi. https://t.co/BQqOw31fyK";9;116;286;2605;in;366987179;1658704086081110016;jokowi;https://twitter.com/jokowi/status/1658704086081110016
Tue May 16 15:55:06 +0000 2023;1658501333543157760;"Pertandingan yang dramatis sepanjang 120 menit, diwarnai hujan kartu merah dan kuning, gol-gol indah bahkan sampai injury time. Akhirnya, Tim Garuda Muda mempersembahkan medali emas sepakbola dari SEA Games 2023, akhir sebuah penantian selama 32 tahun.  Selamat, Garuda Muda! https://t.co/fDlruOlMmX";338;1105;6302;46966;in;366987179;1658501333543157760;jokowi;https://twitter.com/jokowi/status/1658501333543157760
Tue May 16 12:07:13 +0000 2023;1658443986976272392;"Tidak hanya di Jambi, provinsi lain juga masih banyak yang memerlukan penanganan perbaikan jalan. Pemerintah pusat dan daerah akan mengerjakannya bersama-sama. https://t.co/TksSTeDPic";6;49;103;984;in;366987179;1658443942927663106;jokowi;https://twitter.com/jokowi/status/1658443986976272392
Tue May 16 12:07:07 +0000 2023;1658443960715739136;"Di Provinsi Jambi jalan kabupaten ada 10.000 km, yang rusak sekitar 4.600 km. Jalan provinsi 1.030 km, yang rusak 250 kilometer. Jalan nasional 1.300 km, yang rusak 130 km.   Pemerintah akan memperbaiki sejumlah jalan rusak tersebut, utamanya jalan produksi dan jalan logistik. https://t.co/riIGGrbu8u";8;42;106;1027;in;366987179;1658443942927663106;jokowi;https://twitter.com/jokowi/status/1658443960715739136
Tue May 16 12:07:03 +0000 2023;1658443942927663106;"Menyusuri ruas Jalan Kota Jambi hingga Desa Sungai Gelam di Kab. Muaro Jambi dengan mobil, hari ini. Sebagian jalannya masih rusak. Ada jalan kabupaten, ada jalan provinsi.  Sebagian jalan rusak yang saya lalui itu, perbaikannya akan diambil alih oleh pemerintah pusat. https://t.co/GGViNaTQPa";72;419;575;5085;in;366987179;1658443942927663106;jokowi;https://twitter.com/jokowi/status/1658443942927663106
Tue May 16 09:03:35 +0000 2023;1658397774449352705;"Mampir di SMK Negeri 4 Kota Jambi siang ini. Para siswa berbagai jurusan sedang melaksanakan praktikum.   SMK ini memiliki program kuliner, perhotelan, busana, tata kecantikan dan spa. Saya pun memesan baju kepada siswa tata busana.   Buat satu dulu ya. Kalau pas, buat satu lagi. https://t.co/8IM7nQ6K7q";23;132;359;3267;in;366987179;1658397774449352705;jokowi;https://twitter.com/jokowi/status/1658397774449352705
Tue May 16 08:57:23 +0000 2023;1658396212909969408;"Saya meminta pemerintah daerah untuk terus memantau harga-harga di pasar. Kalau perlu, mengalokasikan APBD untuk membantu biaya transportasi komoditas dari tempat produksi ke pasar. Ini langkah konkret yang dapat dilakukan dalam pengendalian inflasi. https://t.co/aZUa51o714";3;19;87;709;in;366987179;1658396202822668289;jokowi;https://twitter.com/jokowi/status/1658396212909969408
Tue May 16 08:57:20 +0000 2023;1658396202822668289;"Libur Lebaran usai, harga-harga komoditas pangan tetap stabil. Bahkan di Pasar Rakyat Talang Banjar, Kota Jambi, harga sejumlah komoditas cenderung turun.  Saya sempat berbincang dan memberikan bantuan modal kerja kepada para pedagang di pasar ini. https://t.co/fSY0jtsvzP";12;56;203;1666;in;366987179;1658396202822668289;jokowi;https://twitter.com/jokowi/status/1658396202822668289
Tue May 16 02:59:11 +0000 2023;1658306069914083334;"Tiba di Bandara Sultan Thaha, Jambi, pagi ini untuk beberapa agenda kunjungan kerja. Saya antara lain akan mengunjungi Pasar Rakyat Talang Banjar, Kota Jambi untuk meninjau aktivitas perekonomian sekaligus menyerahkan bantuan sosial kepada para pedagang. https://t.co/azlJeuTy2a";20;164;277;2324;in;366987179;1658306069914083334;jokowi;https://twitter.com/jokowi/status/1658306069914083334
Tue May 16 00:38:05 +0000 2023;1658270559757803522;"Terima kasih kepada TNI, Polri, dan seluruh pecinta lingkungan, yang telah bersama-sama merehabilitasi hutan mangrove kita.   Saya berharap proses pelestarian mangrove tidak sebatas penanaman di awal saja, tetapi perlu dilakukan perawatan lebih lanjut sehingga hasilnya maksimal. https://t.co/A0IBSgomFv";5;29;134;1156;in;366987179;1658270549439840256;jokowi;https://twitter.com/jokowi/status/1658270559757803522
Tue May 16 00:38:02 +0000 2023;1658270549439840256;"Menanam mangrove bersama anggota TNI-Polri, pelajar, dan masyarakat  di Taman Wisata Alam Angke Kapuk, kemarin. Kegiatan ini dilaksanakan secara serentak oleh jajaran TNI di seluruh Indonesia.   Hutan mangrove kita terluas di dunia, 3,3 juta ha. Ini perlu dijaga dan dirawat. https://t.co/xPlzoTaEHS";40;221;523;4998;in;366987179;1658270549439840256;jokowi;https://twitter.com/jokowi/status/1658270549439840256
Mon May 15 06:28:27 +0000 2023;1657996344492175360;"Karena itulah, saya meminta seluruh pihak di sektor pertanian untuk menyukseskan sensus pertanian tahun 2023 yang akan digelar selama dua bulan, 1 Juni hingga 30 Juli 2023.  Sensus ini mencakup pertanian, perkebunan, peternakan, perikanan, dan kehutanan. https://t.co/LbRCIeQVyD";6;31;108;872;in;366987179;1657996334522310656;jokowi;https://twitter.com/jokowi/status/1657996344492175360
Mon May 15 06:28:24 +0000 2023;1657996334522310656;"Data yang akurat sangat diperlukan untuk memutuskan sebuah kebijakan yang tepat, salah satunya dalam sektor pertanian.   Mengapa? Sektor pertanian melibatkan hajat hidup orang banyak, menyediakan lapangan kerja untuk 40 juta orang atau 29% dari total angkatan kerja kita. https://t.co/AhORr15nn5";49;407;408;3168;in;366987179;1657996334522310656;jokowi;https://twitter.com/jokowi/status/1657996334522310656
Mon May 15 01:06:56 +0000 2023;1657915431557152770;"Kita memiliki peluang untuk jadi negara maju di tahun 2030-an.  Saat itu, Indonesia mengalami bonus demografi. Memilih pemimpin di tahun 2024 adalah bagian dari persiapan jadi negara maju. Apabila salah memilih pemimpin, kesempatan langka itu akan hilang. https://t.co/Hs4Gn9yKCN";257;1126;867;5375;in;366987179;1657915431557152770;jokowi;https://twitter.com/jokowi/status/1657915431557152770
Sun May 14 14:21:54 +0000 2023;1657753104522309632;"Ada banyak syarat jadi pemimpin. Tapi untuk negara besar Indonesia, dengan penduduk 280 juta, kita membutuhkan pemimpin yang dekat dengan rakyat, paham hati rakyat, dan pemberani demi rakyat. Bukan pemimpin yang hanya duduk di istana. https://t.co/xtAUXlJ91z";224;1057;915;5521;in;366987179;1657753104522309632;jokowi;https://twitter.com/jokowi/status/1657753104522309632
Sun May 14 13:38:53 +0000 2023;1657742278579097601;"Di tangan Singgih Susilo Kartono, seorang desainer produk yang bekerja di desa, bambu menjadi sepeda yang bisa dikayuh di jalan-jalan, menjadi gaya hidup sehat dan berkelas.   Dengan desain dan kemasan yang baik, Spedagi menjadikan bambu mendapatkan nilai tambah  berlipat ganda. https://t.co/Yy9id9Dtpz";36;95;530;3345;in;366987179;1657742278579097601;jokowi;https://twitter.com/jokowi/status/1657742278579097601
Sun May 14 08:10:03 +0000 2023;1657659527419011072;"Minggu pagi yang cerah di Jakarta, berbaur dengan warga di kawasan hari bebas kendaraan bermotor.  Di sepanjang Jalan Sudirman-Thamrin warga terlihat ramai bersepeda atau berjalan kaki. Saya sendiri mengayuh sepeda bambu. https://t.co/jwHm99YBUr";15;106;314;2970;in;366987179;1657659527419011072;jokowi;https://twitter.com/jokowi/status/1657659527419011072
Sun May 14 03:29:11 +0000 2023;1657588842432720896;"KTT ke-42 ASEAN di Labuan Bajo telah selesai. Di tempat yang indah ini, pertemuan para pemimpin negara ASEAN berlangsung akrab, hangat, dan menyenangkan.   Terima kasih atas kehadiran para pemimpin ASEAN. Mari bekerja keras menjadikan ASEAN Matters: Epicentrum of Growth. https://t.co/GHrc3ApJ5a";51;179;825;7670;in;366987179;1657588842432720896;jokowi;https://twitter.com/jokowi/status/1657588842432720896
Thu May 11 13:18:48 +0000 2023;1656650059914829824;"Usai sudah pelaksanaan KTT ASEAN ke-42 pada tanggal 10-11 Mei 2023 di Labuan Bajo, NTT. Saya dan Ibu Negara pun kembali ke Jakarta dari Bandar Udara Komodo, Kabupaten Manggarai Barat. https://t.co/cV076t4dm0";16;220;392;4276;in;366987179;1656650059914829824;jokowi;https://twitter.com/jokowi/status/1656650059914829824
Thu May 11 13:15:54 +0000 2023;1656649332358250499;"KTT ke-42 ASEAN yang berlangsung 10-11 Mei 2023 di Labuan Bajo, telah berjalan lancar dan memberikan hasil yang baik.   Melalui KTT ini, Indonesia ingin melihat ASEAN yang kuat, mampu menghadapi tantangan, tanggap terhadap dinamika, serta tetap memegang peran sentral di kawasan. https://t.co/3qoT0zBD9J";9;70;303;2669;in;366987179;1656649332358250499;jokowi;https://twitter.com/jokowi/status/1656649332358250499
Thu May 11 08:49:43 +0000 2023;1656582344260845568;"Membuka KTT ke-15 IMT-GT di Labuan Bajo tadi, saya mengajak semua pihak yang terlibat untuk mengobarkan semangat kolaborasi, khususnya dengan peningkatan daya saing konektivitas, pariwisata, dan investasi. https://t.co/ofXBDPDHNr";2;21;101;840;in;366987179;1656582337461891080;jokowi;https://twitter.com/jokowi/status/1656582344260845568
Thu May 11 08:49:41 +0000 2023;1656582337461891080;"Di usianya yang ke-30 tahun, Segitiga Pertumbuhan Indonesia-Malaysia-Thailand atau IMT-GT telah menjadi kerja sama segitiga emas bagi 85 juta penduduk di tiga negara.   Di tengah krisis global saja, volume perdagangan IMT-GT berhasil mencapai 618 miliar US dolar di tahun 2021. https://t.co/UxJww6lFh5";12;102;372;3614;in;366987179;1656582337461891080;jokowi;https://twitter.com/jokowi/status/1656582337461891080
Thu May 11 06:42:08 +0000 2023;1656550239371956224;"Baju tenun songke Manggarai pas benar dikenakan para pemimpin negara ASEAN yang mengikuti KTT ke-42 ASEAN di Labuan Bajo.   Tenun khas masyarakat Manggarai yang berdiam di sisi barat Pulau Flores ini biasanya dikenakan saat acara-acara adat, seperti kenduri, membuka ladang, dll. https://t.co/m2P2v05TOe";16;71;383;2576;in;366987179;1656550239371956224;jokowi;https://twitter.com/jokowi/status/1656550239371956224
Thu May 11 06:38:18 +0000 2023;1656549274816217088;"Sementara itu, terkait dengan implementasi AOIP, diperlukan kerja sama konkret dan inklusif untuk mengurangi ketegangan di Indo-Pasifik. Salah satunya, melalui ASEAN Indo-Pacific Infrastructure Forum. https://t.co/8BTr6xez8R";1;7;91;724;in;366987179;1656549244407517184;jokowi;https://twitter.com/jokowi/status/1656549274816217088
Thu May 11 06:38:16 +0000 2023;1656549264145928193;"Terus terang, implementasi Lima Poin Konsensus terkait Myanmar yang disepakati pemimpin ASEAN tahun 2021, belum ada kemajuan signifikan.   Kendati begitu, isu Myanmar jangan sampai menghambat percepatan pembangunan komunitas ASEAN. https://t.co/AIyiyj9HSh";4;15;99;868;in;366987179;1656549244407517184;jokowi;https://twitter.com/jokowi/status/1656549264145928193
Thu May 11 06:38:13 +0000 2023;1656549253630787585;"Sebagai ketua ASEAN, Indonesia terus mengupayakan implementasi Lima Poin Kesepakatan dengan terus mendorong dialog yang inklusif, menyerukan penghentian kekerasan, dan memfasilitasi penyelesaian joint needs assesment, dan menyalurkan bantuan kemanusiaan. https://t.co/bXy2F6Q2rp";1;4;55;446;in;366987179;1656549244407517184;jokowi;https://twitter.com/jokowi/status/1656549253630787585
Thu May 11 06:38:11 +0000 2023;1656549244407517184;"Hari kedua KTT ke-42 ASEAN di Labuan Bajo, saya membuka Sesi Retreat yang membahas dua hal utama yaitu implementasi dari Lima Poin Kesepakatan atau Five Point Consensus dalam menyelesaikan isu Myanmar dan implementasi ASEAN Outlook on the Indo-Pacific (AOIP). https://t.co/KMUemBfPqY";8;48;273;2494;in;366987179;1656549244407517184;jokowi;https://twitter.com/jokowi/status/1656549244407517184
Thu May 11 02:31:55 +0000 2023;1656487269728124929;"Labuan Bajo di NTT adalah salah satu tempat terindah di Indonesia. Para pemimpin negara-negara ASEAN yang hadir di KTT ke-42 ASEAN pun begitu menikmati suasana senja Labuan Bajo dari atas kapal pinisi seusai serangkaian pertemuan di hari pertama, Rabu 10 Mei 2023. https://t.co/MfV6au1VfY";105;221;1019;6233;in;366987179;1656487269728124929;jokowi;https://twitter.com/jokowi/status/1656487269728124929
Thu May 11 01:33:27 +0000 2023;1656472555182764034;"Menjamu para pemimpin negara ASEAN, semalam di Ayana Komodo Waecicu Beach, Labuan Bajo, NTT.   Semoga keindahan alam dan kebaikan masyarakat setempat di sini mendorong kita untuk lebih melihat ASEAN sebagai kawasan yang damai dan stabil, serta sebagai episentrum pertumbuhan. https://t.co/oDQMIfRSjt";20;68;395;2801;in;366987179;1656472555182764034;jokowi;https://twitter.com/jokowi/status/1656472555182764034
Wed May 10 15:56:03 +0000 2023;1656327247949885440;"Hari ini saya membuka 5 acara, salah satunya pertemuan pemimpin ASEAN dengan Satgas Tingkat Tinggi tentang Visi Komunitas ASEAN Pasca-2025. Satgas telah bekerja keras mengidentifikasi tantangan dan peluang ke depan dan memastikan kontribusi ASEAN bagi kemajuan kawasan dan dunia.";1;23;104;1200;in;366987179;1656327244548276224;jokowi;https://twitter.com/jokowi/status/1656327247949885440
Wed May 10 15:56:02 +0000 2023;1656327244548276224;"Menikmati senja di Labuan Bajo bersama para pemimpin ASEAN dan pendamping masing-masing selepas rangkaian acara yang padat di hari pertama KTT ke-42 ASEAN. https://t.co/yh2SwsNdlR";411;797;1938;27181;in;366987179;1656327244548276224;jokowi;https://twitter.com/jokowi/status/1656327244548276224
Wed May 10 13:12:20 +0000 2023;1656286045368119297;"Pertemuan pemimpin ASEAN dengan Perwakilan dari ASEAN Business Advisory Council (ASEAN-BAC) hari ini di Labuan Bajo.  Saya menyampaikan rasa syukur karena ASEAN telah mampu menghadapi pandemi Covid-19 berkat kolaborasi dan kerja sama dari seluruh sektor, termasuk dunia usaha. https://t.co/UqN1vfgbPk";13;47;350;2480;in;366987179;1656286045368119297;jokowi;https://twitter.com/jokowi/status/1656286045368119297
Wed May 10 09:55:13 +0000 2023;1656236441821917184;"Dalam rangkaian KTT ke-42 ASEAN, para pemimpin ASEAN juga bertemu perwakilan Pemuda ASEAN, hari ini.   Kami menaruh harapan besar pada generasi muda ASEAN yang memiliki energi positif, ide kreatif dan inovatif untuk meneruskan keberlangsungan kawasan sebagai pusat pertumbuhan. https://t.co/V47YBsi0vP";7;45;230;1575;in;366987179;1656236441821917184;jokowi;https://twitter.com/jokowi/status/1656236441821917184
Wed May 10 09:49:50 +0000 2023;1656235085002326016;"Pada kesempatan ini, saya menyampaikan terima kasih atas dukungan parlemen di ASEAN sehingga kebijakan saat masa darurat pandemi dapat dilakukan dengan cepat dan ASEAN dapat melewati masa kritis. https://t.co/Jh4IzKJEui";1;11;75;655;in;366987179;1656235077708451841;jokowi;https://twitter.com/jokowi/status/1656235085002326016
Wed May 10 09:49:48 +0000 2023;1656235077708451841;"Pertemuan pemimpin ASEAN dengan perwakilan ASEAN Inter-Parliamentary Assembly (AIPA) di Labuan Bajo, dalam rangkaian KTT ke-42 ASEAN, hari ini.  Kolaborasi pemerintah dengan parlemen negara ASEAN harus diperkuat untuk memperkokoh stabilitas politik dan demokrasi di kawasan. https://t.co/Z6UG2LLWcd";10;35;290;2213;in;366987179;1656235077708451841;jokowi;https://twitter.com/jokowi/status/1656235077708451841
Wed May 10 08:38:05 +0000 2023;1656217029224067072;"Ibu Negara menemui para pendamping pemimpin ASEAN di Puncak Waringin saat KTT ASEAN berlangsung di Labuan Bajo, NTT.  Ibu Negara mengajak para pendamping pemimpin ASEAN menyaksikan demo menganyam dan menenun kain, menonton tari, permainan tradisional, hingga lagu daerah NTT. https://t.co/4fbXDqrUXk";5;49;325;2739;in;366987179;1656217029224067072;jokowi;https://twitter.com/jokowi/status/1656217029224067072
Wed May 10 06:59:50 +0000 2023;1656192305278386176;"Para pemimpin negara-negara ASEAN bergandeng tangan sebelum acara pembukaan KTT ke-42 ASEAN di Labuan Bajo, NTT, pagi ini. Dengan persatuan, ASEAN akan mampu menjadi pemain sentral dalam membawa perdamaian dan pertumbuhan. ASEAN Matters: Epicentrum of Growth. https://t.co/2vCY0sPdvC";24;69;352;2795;in;366987179;1656192305278386176;jokowi;https://twitter.com/jokowi/status/1656192305278386176
Wed May 10 06:20:49 +0000 2023;1656182486232358912;"Kita punya aset kuat sebagai epicentrum of growth: ekonomi yang tumbuh jauh di atas rerata dunia, bonus demografi, dan kestabilan kawasan yang terjaga.  Mari bekerja keras menjadikan ASEAN Matters: Epicentrum of Growth.";2;13;60;457;in;366987179;1656182469656481792;jokowi;https://twitter.com/jokowi/status/1656182486232358912
Wed May 10 06:20:48 +0000 2023;1656182482826584065;"Persatuan dibutuhkan menghadapi situasi ekonomi global yang belum sepenuhnya pulih, rivalitas di dunia yang semakin tajam, dan dinamika dunia semakin tidak terprediksi.  Dengan persatuan, ASEAN akan mampu menjadi pemain sentral dalam membawa perdamaian dan pertumbuhan.";1;10;67;477;in;366987179;1656182469656481792;jokowi;https://twitter.com/jokowi/status/1656182482826584065
Wed May 10 06:20:45 +0000 2023;1656182469656481792;"KTT ke-42 ASEAN dibuka di Labuan Bajo, pagi ini, dihadiri para pemimpin negara ASEAN, Sekjen ASEAN, dan PM Timor-Leste yang untuk pertama kalinya mengikuti KTT ASEAN.   Di hadapan para pemimpin ASEAN, saya menyerukan perlunya memperkokoh persatuan di antara negara-negara ASEAN. https://t.co/NlqxqwlsBm";16;70;389;2598;in;366987179;1656182469656481792;jokowi;https://twitter.com/jokowi/status/1656182469656481792
Wed May 10 04:17:26 +0000 2023;1656151433660743680;"KTT ke-42 ASEAN di Labuan Bajo, NTT akan dihadiri oleh delapan pemimpin negara ASEAN, Sekretaris Jenderal ASEAN, dan Perdana Menteri Timor-Leste.   Selamat datang para sahabat, pemimpin negara-negara ASEAN dan seluruh delegasi KTT ke-42 ASEAN di Labuan Bajo. https://t.co/uilljbEJLe";14;51;351;2356;in;366987179;1656151433660743680;jokowi;https://twitter.com/jokowi/status/1656151433660743680
Tue May 09 14:56:37 +0000 2023;1655949902705479687;"Kepada PM Timor-Leste secara khusus menyampaikan ucapan selamat datang atas keikutsertaan Timor-Leste yang pertama kali dalam KTT ASEAN.  Besok, di Hotel Meruaroh rencananya akan ada lima pertemuan pada KTT ke-42 ASEAN. https://t.co/nkCS32lAjv";2;15;104;890;in;366987179;1655949889849950214;jokowi;https://twitter.com/jokowi/status/1655949902705479687
Tue May 09 14:56:34 +0000 2023;1655949889849950214;"Seharian ini, saya melakukan pertemuan bilateral dengan beberapa pemimpin negara ASEAN di Hotel Meruaroh, Labuan Bajo.   Saya bertemu berturut-turut dengan PM Vietnam Pham Minh Chinh, PM Timor-Leste Taur Matan Ruak, PM Malaysia Anwar Ibrahim, dan PM Laos Sonexay Siphandone. https://t.co/CbQlohiE8n";10;134;449;4694;in;366987179;1655949889849950214;jokowi;https://twitter.com/jokowi/status/1655949889849950214
